{
  "schema_version": 1,
  "phase": "initial-review",
  "current_task_id": null,
  "tasks": [
    {"id": "paper-comprehension", "type": "analysis", "status": "pending", "description": "Explain the paper's problem, method, assumptions, and evidence without critique.", "inputs": ["shared/paper/paper.md", "shared/paper/paper-dossier.json"], "output_path": "phases/initial-review/artifacts/paper-comprehension.json", "completion_predicate": "Accurate anchored whole-paper comprehension artifact exists.", "retry_feedback": null, "attempt_count": 0, "blocked_reason": null, "completed_at": null},
    {"id": "contribution-map", "type": "analysis", "status": "pending", "description": "Map claimed contributions to sections, theorems, equations, and experiments.", "inputs": ["shared/paper/paper-dossier.json", "shared/paper/anchors.json"], "output_path": "phases/initial-review/artifacts/contribution-map.json", "completion_predicate": "Every central contribution has resolving anchors.", "retry_feedback": null, "attempt_count": 0, "blocked_reason": null, "completed_at": null},
    {"id": "claim-audit", "type": "analysis", "status": "pending", "description": "Audit central claims for support, scope, assumptions, and contradictions.", "inputs": ["shared/paper/paper.md", "shared/paper/paper-dossier.json"], "output_path": "phases/initial-review/artifacts/claim-audit.json", "completion_predicate": "Central claims have anchored support assessments.", "retry_feedback": null, "attempt_count": 0, "blocked_reason": null, "completed_at": null},
    {"id": "theory-audit", "type": "analysis", "status": "pending", "description": "Audit definitions, theorem statements, proof dependencies, and formal scope.", "inputs": ["shared/paper/paper.md", "shared/paper/paper-dossier.json"], "output_path": "phases/initial-review/artifacts/theory-audit.json", "completion_predicate": "Central theory claims receive anchored scrutiny.", "retry_feedback": null, "attempt_count": 0, "blocked_reason": null, "completed_at": null},
    {"id": "experiment-audit", "type": "analysis", "status": "pending", "description": "Audit datasets, baselines, metrics, uncertainty, ablations, and reporting.", "inputs": ["shared/paper/paper.md", "shared/paper/paper-dossier.json"], "output_path": "phases/initial-review/artifacts/experiment-audit.json", "completion_predicate": "Empirical claims and limitations are anchored.", "retry_feedback": null, "attempt_count": 0, "blocked_reason": null, "completed_at": null},
    {"id": "related-work-plan", "type": "research-plan", "status": "pending", "description": "Identify novelty questions that require controlled literature research.", "inputs": ["shared/paper/paper-dossier.json"], "output_path": "phases/initial-review/artifacts/related-work-plan.json", "completion_predicate": "Decision-relevant broker queries are scoped without searching directly.", "retry_feedback": null, "attempt_count": 0, "blocked_reason": null, "completed_at": null},
    {"id": "literature-research", "type": "analysis", "status": "pending", "description": "Interpret admissible broker evidence for related-work and novelty claims.", "inputs": ["shared/validation/published/broker-evidence.json", "literature-registry.json"], "output_path": "phases/initial-review/artifacts/literature-research.json", "completion_predicate": "External claims cite verified broker source IDs only.", "retry_feedback": null, "attempt_count": 0, "blocked_reason": null, "completed_at": null},
    {"id": "validation-bundle-review", "type": "analysis", "status": "pending", "description": "Interpret published validator evidence and its decision relevance.", "inputs": ["shared/validation/published"], "output_path": "phases/initial-review/artifacts/validation-bundle-review.json", "completion_predicate": "Validator evidence is interpreted rather than copied.", "retry_feedback": null, "attempt_count": 0, "blocked_reason": null, "completed_at": null},
    {"id": "severity-calibration", "type": "analysis", "status": "pending", "description": "Calibrate each concern severity to affected claims and decision impact.", "inputs": ["phases/initial-review/artifacts"], "output_path": "phases/initial-review/artifacts/severity-calibration.json", "completion_predicate": "Concern severity is consistent and actionable.", "retry_feedback": null, "attempt_count": 0, "blocked_reason": null, "completed_at": null},
    {"id": "score-calibration", "type": "analysis", "status": "pending", "description": "Choose independent axis, overall, and confidence scores from evidence.", "inputs": ["phases/initial-review/artifacts"], "output_path": "phases/initial-review/artifacts/score-calibration.json", "completion_predicate": "Scores match prose and overall is not averaged.", "retry_feedback": null, "attempt_count": 0, "blocked_reason": null, "completed_at": null},
    {"id": "official-review-assembly", "type": "publication", "status": "pending", "description": "Assemble immutable official review version 1 from completed audits.", "inputs": ["phases/initial-review/artifacts"], "output_path": "phases/initial-review/artifacts/official-review-assembly.json", "completion_predicate": "Official review schema passes and all weaknesses have anchors.", "retry_feedback": null, "attempt_count": 0, "blocked_reason": null, "completed_at": null},
    {"id": "review-self-audit", "type": "quality-gate", "status": "pending", "description": "Run the completion gate and emit the corrected official review.", "inputs": ["phases/initial-review/artifacts/official-review-assembly.json", "shared/paper/anchors.json"], "output_path": "phases/initial-review/artifacts/official-review.json", "completion_predicate": "Review checker passes with matching concern ledger.", "retry_feedback": null, "attempt_count": 0, "blocked_reason": null, "completed_at": null}
  ]
}
